{
 "schemaVersion": 1,
 "placeId": "place.dunmer-north.riverwalk",
 "generator": "python3 -m worldgen.blueprint_promises --id <place-id> --write (decision 0104); never hand-edit a row but its `unfilled` or `confirmed` block",
 "derivedFrom": [
  {
   "file": "world/sources/catalogue/places-dunmer-north.json",
   "sha256": "266fa75e895864ed26cbe8903d2fd67c19d6d55ce8f10d7207d7636d4afcb715"
  },
  {
   "file": "world/sources/quests/local-dunmer-north.json",
   "sha256": "1c8f5e88f15d28dc684e6939be325705279744c21ee43459295fed08c07380a5"
  },
  {
   "file": "world/sources/routes/travel-services.json",
   "sha256": "b31d925a55f6b106ddde6f2e0722b284e276efc90b287970cd18bca3dd44a49b"
  }
 ],
 "promises": [
  {
   "id": "promise.riverwalk.evidence-the-plank-ages",
   "kind": "socketBucket",
   "source": {
    "file": "world/sources/catalogue/places-dunmer-north.json",
    "path": "places[place.dunmer-north.riverwalk].sockets.evidence[evidence.riverwalk.the-plank-ages]"
   },
   "text": "Riverwalk has the evidence socket evidence.riverwalk.the-plank-ages.",
   "unfilled": null
  },
  {
   "id": "promise.riverwalk.interior-principal",
   "kind": "interior",
   "source": {
    "file": "world/sources/catalogue/places-dunmer-north.json",
    "path": "places[place.dunmer-north.riverwalk].interior"
   },
   "text": "Riverwalk's principal interior is a dwelling (S1), entered by 2 door.",
   "unfilled": null
  },
  {
   "id": "promise.riverwalk.occupant-n1",
   "kind": "occupant",
   "source": {
    "file": "world/sources/catalogue/places-dunmer-north.json",
    "path": "places[place.dunmer-north.riverwalk].contents.npcs[n1]"
   },
   "text": "Riverwalk has few family occupants.",
   "unfilled": null
  },
  {
   "id": "promise.riverwalk.occupant-n2",
   "kind": "occupant",
   "source": {
    "file": "world/sources/catalogue/places-dunmer-north.json",
    "path": "places[place.dunmer-north.riverwalk].contents.npcs[n2]"
   },
   "text": "Riverwalk has few crew occupants.",
   "unfilled": null
  },
  {
   "id": "promise.riverwalk.occupant-n3",
   "kind": "occupant",
   "source": {
    "file": "world/sources/catalogue/places-dunmer-north.json",
    "path": "places[place.dunmer-north.riverwalk].contents.npcs[n3]"
   },
   "text": "Riverwalk has few rank-and-file occupants.",
   "unfilled": null
  },
  {
   "id": "promise.riverwalk.occupant-stage-mistress",
   "kind": "occupant",
   "source": {
    "file": "world/sources/catalogue/places-dunmer-north.json",
    "path": "places[place.dunmer-north.riverwalk].notableNpcSlots[stage-mistress]"
   },
   "text": "The stage-mistress lives and works at Riverwalk.",
   "unfilled": null
  },
  {
   "id": "promise.riverwalk.occupant-toll-holder",
   "kind": "occupant",
   "source": {
    "file": "world/sources/catalogue/places-dunmer-north.json",
    "path": "places[place.dunmer-north.riverwalk].notableNpcSlots[toll-holder]"
   },
   "text": "The toll-holder lives and works at Riverwalk.",
   "unfilled": null
  },
  {
   "id": "promise.riverwalk.operator-canoe-dunmer-north-riverwalk-the-tide-fair",
   "kind": "operator",
   "source": {
    "file": "world/sources/routes/travel-services.json",
    "path": "services[canoe.dunmer-north.riverwalk-the-tide-fair].operator"
   },
   "text": "The canoe poler runs the canoe service from Riverwalk.",
   "unfilled": null
  },
  {
   "id": "promise.riverwalk.post-stage-mistress",
   "kind": "socketBucket",
   "source": {
    "file": "world/sources/catalogue/places-dunmer-north.json",
    "path": "places[place.dunmer-north.riverwalk].sockets.post[post.riverwalk.stage-mistress]"
   },
   "text": "Riverwalk has the post socket post.riverwalk.stage-mistress.",
   "unfilled": null
  },
  {
   "id": "promise.riverwalk.post-toll-holder",
   "kind": "socketBucket",
   "source": {
    "file": "world/sources/catalogue/places-dunmer-north.json",
    "path": "places[place.dunmer-north.riverwalk].sockets.post[post.riverwalk.toll-holder]"
   },
   "text": "Riverwalk has the post socket post.riverwalk.toll-holder.",
   "unfilled": null
  },
  {
   "id": "promise.riverwalk.prose-playerpurpose-hook",
   "kind": "prose",
   "source": {
    "file": "world/sources/catalogue/places-dunmer-north.json",
    "path": "places[place.dunmer-north.riverwalk].playerPurpose.hook"
   },
   "text": "The cove where boats put in off the Padomaic run, where the toll is argued nightly and Thorn and Hissmir both claim it.",
   "confirmed": {
    "sha": "4cac5d6f5ed9",
    "note": "Ferry raft and dock run on the cove (ocean body at 0 m); route.boat.archon-thorn 0.92 km; toll claim per why.pressures."
   }
  },
  {
   "id": "promise.riverwalk.prose-questhooks-opportunity",
   "kind": "prose",
   "source": {
    "file": "world/sources/catalogue/places-dunmer-north.json",
    "path": "places[place.dunmer-north.riverwalk].questHooks.opportunity"
   },
   "text": "Thorn and Hissmir both tax the cove village at the mouth of the pilgrim water; paying either one counts as taking its side · the nightly toll argument turns into an accusation somebody can prove",
   "confirmed": {
    "sha": "9c3d614a0cf1",
    "note": "relations.tolls the pilgrim water (route 0.09 km); Thorn 0.95 km and Hissmir 0.28 km are the two claimants."
   }
  },
  {
   "id": "promise.riverwalk.prose-vibe-approach",
   "kind": "prose",
   "source": {
    "file": "world/sources/catalogue/places-dunmer-north.json",
    "path": "places[place.dunmer-north.riverwalk].vibe.approach"
   },
   "text": "Boats come in off the Padomaic run and pole across the cove to the ferry stage on the islet.",
   "confirmed": {
    "sha": "a2d3c5a3f928",
    "note": "Ferry stage (ferryraft01) and dock run built on the cove; Padomaic run lane passes 0.92 km off."
   }
  },
  {
   "id": "promise.riverwalk.prose-vibe-condition",
   "kind": "prose",
   "source": {
    "file": "world/sources/catalogue/places-dunmer-north.json",
    "path": "places[place.dunmer-north.riverwalk].vibe.condition"
   },
   "text": "Constantly re-planked; the boards are all different ages, recording the order in which the village was built.",
   "confirmed": {
    "sha": "7574b8c75cf7",
    "note": "The long walk is laid from plank pieces of mixed wear; the plank-ages evidence socket marks it."
   }
  },
  {
   "id": "promise.riverwalk.prose-vibe-materials",
   "kind": "prose",
   "source": {
    "file": "world/sources/catalogue/places-dunmer-north.json",
    "path": "places[place.dunmer-north.riverwalk].vibe.materials"
   },
   "text": "Piles, planks and lashed handrails over the water. The crews' house stands on the dry spit; the long house stands on piles in the shallows beside it.",
   "confirmed": {
    "sha": "5aef24db92a0",
    "note": "Dock planks on piles across the cove; bamboo huts on padded dry ground on the spit; the swamp house on piles."
   }
  },
  {
   "id": "promise.riverwalk.prose-vibe-mood",
   "kind": "prose",
   "source": {
    "file": "world/sources/catalogue/places-dunmer-north.json",
    "path": "places[place.dunmer-north.riverwalk].vibe.mood"
   },
   "text": "Linear and sociable.",
   "confirmed": {
    "sha": "3efecead8a9e",
    "note": "One walk joins the spit to the islet, so everyone meets on it."
   }
  },
  {
   "id": "promise.riverwalk.prose-vibe-palette",
   "kind": "prose",
   "source": {
    "file": "world/sources/catalogue/places-dunmer-north.json",
    "path": "places[place.dunmer-north.riverwalk].vibe.palette"
   },
   "text": "Silver weathered plank, black water and reed thatch.",
   "confirmed": {
    "sha": "82cba3c2e745",
    "note": "Weathered dock planks, cove water and thatched bamboo huts."
   }
  },
  {
   "id": "promise.riverwalk.prose-vibe-senses",
   "kind": "prose",
   "source": {
    "file": "world/sources/catalogue/places-dunmer-north.json",
    "path": "places[place.dunmer-north.riverwalk].vibe.senses"
   },
   "text": "Boards underfoot from the spit to the islet; poles in the mud; talk carrying over still water.",
   "confirmed": {
    "sha": "db573db76f22",
    "note": "The long walk runs from the spit to the islet; poles and canoe at the stage."
   }
  },
  {
   "id": "promise.riverwalk.prose-vibe-signaturefeature",
   "kind": "prose",
   "source": {
    "file": "world/sources/catalogue/places-dunmer-north.json",
    "path": "places[place.dunmer-north.riverwalk].vibe.signatureFeature"
   },
   "text": "The walk is the street. It crosses open water, so everyone who lands at the stage walks past the toll-holder's post.",
   "confirmed": {
    "sha": "8dd15d30a4e9",
    "note": "The long walk crosses open water from the islet stage to the spit, past socket post-toll-holder at its head."
   }
  },
  {
   "id": "promise.riverwalk.prose-vibe-silhouette",
   "kind": "prose",
   "source": {
    "file": "world/sources/catalogue/places-dunmer-north.json",
    "path": "places[place.dunmer-north.riverwalk].vibe.silhouette"
   },
   "text": "A plank walk across a shallow cove, with the houses and the totems on the spit at one end and the ferry stage on the islet at the other.",
   "confirmed": {
    "sha": "b6de5ed2ef4c",
    "note": "17 dock pieces form the plank walk; two argoniantotem01 and the huts on the spit; ferry stage at the far end."
   }
  },
  {
   "id": "promise.riverwalk.prose-why-founding",
   "kind": "prose",
   "source": {
    "file": "world/sources/catalogue/places-dunmer-north.json",
    "path": "places[place.dunmer-north.riverwalk].why.founding"
   },
   "text": "A halt in a sheltered sea cove at the mouth of the pilgrim water, the channel up to Hissmir. Boats off the Padomaic run put in here. The houses stand along the plank walk, which serves as the village street.",
   "confirmed": {
    "sha": "b4d4e673b9bb",
    "note": "Cove (plotFacts landform cove, ocean); pilgrim-water track 0.09 km; plank walk built as the street."
   }
  },
  {
   "id": "promise.riverwalk.prose-why-occupantsmotive",
   "kind": "prose",
   "source": {
    "file": "world/sources/catalogue/places-dunmer-north.json",